{
  "$schema" : "https://json-schema.org/draft/2019-09/schema",
  "type" : "object",
  "properties" : {
    "id" : {
      "type" : "string",
      "format" : "uuid",
      "description" : "UID (v5) for the Card (atomic) generated by YGOJSON."
    },
    "identifiers" : {
      "allOf" : [ {
        "type" : "object",
        "properties" : {
          "konamiId" : {
            "type" : "integer",
            "description" : "ID on the <a href=\"https://www.db.yugioh-card.com/yugiohdb/\">Yu-Gi-Oh official database</a>.\n\nThe ID might not appear on the official database for some languages if it was not released yet on that location.\nAlso, cards might not have an ID if nor released at all."
          },
          "password" : {
            "type" : "integer",
            "description" : "Unique 8-digit number printed in the bottom of cards, which is the same in all languages and prints.\n\nNote that certain cards does not have a password."
          },
          "passwordAlt" : {
            "type" : "integer",
            "description" : "Unique 8-digit number printed in the bottom of different prints of a card on some special cases.\n\nExamples of these are the <em>Dark Magician (Arkana)</em> and the alternative art of <em>Polymerization</em>"
          },
          "yugipediaPageId" : {
            "type" : "integer",
            "description" : "Page ID on <a href=\"https://yugipedia.com\">Yugipedia</a>.\n\nThis ID can be used on the <a href=\"https://yugipedia.com/api.php\">Yugipedia API</a> as the <em>pageId</em> or <em>pageids</em> parameters."
          }
        },
        "description" : "Identifiers associated to the Card (atomic).\n\nThis model is a container of third-party IDs associated with the Card (atomic)."
      }, {
        "description" : "Identifiers associated to the card."
      } ]
    },
    "name" : {
      "type" : "string",
      "description" : "Name of the card"
    },
    "cardType" : {
      "allOf" : [ {
        "type" : "string",
        "enum" : [ "monster", "spell", "trap" ],
        "description" : "Enum values for the main card types."
      }, {
        "description" : "Main card type."
      } ]
    },
    "property" : {
      "type" : "string",
      "description" : "Special property for the spell or trap (lower-case).\n\nThese are the properties represented by the spell/trap icon.",
      "pattern" : "[a-z]+"
    },
    "effectText" : {
      "type" : "string",
      "description" : "Effect text for the card (empty for Normal Monsters).\n\nNote that the list of materials and pendulum effects are not included as they are part of their own property.\n"
    },
    "monsterTypes" : {
      "description" : "Array of lower-case values for the monster-type line.",
      "type" : "array",
      "items" : {
        "type" : "string",
        "pattern" : "[a-z]+"
      }
    },
    "flavorText" : {
      "type" : "string",
      "description" : "Flavor text on a normal monster.\n\nIf the monster is an effect monster, this would be empty."
    },
    "attribute" : {
      "type" : "string",
      "description" : "Attribute of the monster (lower case).\n\nIf the monster is an effect monster, this would be empty.",
      "pattern" : "[a-z]+"
    },
    "atk" : {
      "type" : "integer",
      "description" : "Actual ATK value.\n\nIf <tt>0</tt>, it can also be undefined.\nIn that case, the <tt>atkUndefined</tt> property would be equal to <tt>true</tt>.",
      "minimum" : 0
    },
    "atkUndefined" : {
      "type" : "boolean",
      "description" : "Flag indicating an undefined (<tt>?</tt>) ATK value."
    },
    "def" : {
      "type" : "integer",
      "description" : "Actual DEF value.\n\nIf <tt>0</tt>, it can also be undefined.\nIn that case, the <tt>defUndefined</tt> property would be equal to <tt>true</tt>.",
      "minimum" : 0
    },
    "defUndefined" : {
      "type" : "boolean",
      "description" : "Flag indicating an undefined (<tt>?</tt>) DEF value."
    },
    "level" : {
      "type" : "integer",
      "description" : "Level of the monster.",
      "minimum" : 0
    },
    "materials" : {
      "type" : "string",
      "description" : "Materials for extra-deck monsters as defined on the card-text."
    },
    "pendulumEffect" : {
      "type" : "string",
      "description" : "Effect of the Pendulum monster."
    },
    "pendulumScale" : {
      "type" : "integer",
      "description" : "Scale of the Pendulum monster.",
      "minimum" : 0
    },
    "linkRating" : {
      "type" : "integer",
      "description" : "Link rating of the link monster.",
      "minimum" : 0
    },
    "linkArrows" : {
      "description" : "Link arrows of the link monster.",
      "maxItems" : 8,
      "type" : "array",
      "items" : {
        "type" : "string",
        "enum" : [ "top-left", "top-center", "top-right", "middle-left", "middle-right", "bottom-left", "bottom-center", "bottom-right" ],
        "description" : "Enum values for the arrows on link monster."
      }
    },
    "xyzRank" : {
      "type" : "integer",
      "description" : "Rank of the XYZ monster.",
      "minimum" : 0
    },
    "localizedData" : {
      "type" : "object",
      "properties" : {
        "es" : {
          "type" : "object",
          "properties" : {
            "name" : {
              "type" : "string",
              "description" : "Name of the card"
            },
            "effectText" : {
              "type" : "string",
              "description" : "Effect text for the card (empty for Normal Monsters).\n\nNote that the list of materials and pendulum effects are not included as they are part of their own property.\n"
            },
            "flavorText" : {
              "type" : "string",
              "description" : "Flavor text on a normal monster.\n\nIf the monster is an effect monster, this would be empty."
            },
            "materials" : {
              "type" : "string",
              "description" : "Materials for extra-deck monsters as defined on the card-text."
            },
            "pendulumEffect" : {
              "type" : "string",
              "description" : "Effect of the Pendulum monster."
            }
          },
          "description" : "Describes card text that can be localized.\n\nOnly card information that is not an enum is included."
        },
        "ja" : {
          "type" : "object",
          "properties" : {
            "name" : {
              "type" : "string",
              "description" : "Name of the card"
            },
            "effectText" : {
              "type" : "string",
              "description" : "Effect text for the card (empty for Normal Monsters).\n\nNote that the list of materials and pendulum effects are not included as they are part of their own property.\n"
            },
            "flavorText" : {
              "type" : "string",
              "description" : "Flavor text on a normal monster.\n\nIf the monster is an effect monster, this would be empty."
            },
            "materials" : {
              "type" : "string",
              "description" : "Materials for extra-deck monsters as defined on the card-text."
            },
            "pendulumEffect" : {
              "type" : "string",
              "description" : "Effect of the Pendulum monster."
            }
          },
          "description" : "Describes card text that can be localized.\n\nOnly card information that is not an enum is included."
        }
      },
      "description" : "Describes translations and locale-specific data for a card.\n\nAll translated properties match the name of the original property\nand any missing property indicates no translation for it."
    }
  },
  "$id" : "io.github.ygojson.model.data.Card",
  "description" : "Describes the information for a card.\n\nThis model contains the properties of the card that will not change from print to print."
}